{"analysis_version":"0.1.0a2","bundle_sha256":"49ffe87ac0ea0657bafd30c8356389910e486322b6e5381052f8cfd11aefce71","counts":{"measured":{"planned":16,"started":16,"timed":16,"unstarted":0,"validated":16},"warmup":{"planned":0,"started":0,"timed":0,"unstarted":0,"validated":0}},"descriptive":{"mean_a_ns":{"denominator":1,"numerator":170000000},"mean_b_ns":{"denominator":1,"numerator":180000000},"mean_difference_ns":{"denominator":1,"numerator":10000000},"n":8,"ratio_b_over_a":{"denominator":17,"numerator":18},"sum_a_ns":1360000000,"sum_b_ns":1440000000},"evidence_status":"complete","inference_status":"available","plan_id":"sha256:7fdc0c9980b5dacddf1fd318b584a4efee2757a63e56557e1dd92dc0e36ece9b","reasons":[],"schema":"benchinterlace.report.v1","test":{"alternative":"two-sided","assignment_count":256,"method":"exact-paired-assignment-v1","p_decimal":"0.007812500000","statistic_sum_difference_ns":80000000,"tail_count":2},"warnings":[{"code":"assumptions_unverified","text":"Assumption-qualified calculation. Alternative: two-sided. Requires genuinely independent fair AB/BA assignment and the global sharp null: every measured slot duration is invariant under every complete assignment history, including direct and carryover effects. This is not a weak mean-null test or a causal mechanism claim."},{"code":"no_complete_provenance","text":"Hashes establish byte consistency, not authentic collection, truthful timing, genuine randomness, independent preregistration, or unchanged undeclared dependencies. Recorded absolute input paths are inert during verification."},{"code":"repeated_attempts_uncontrolled","text":"Unseen discarded plans, seed/order selection, repeated attempts until completion or a favorable result, and selective reporting are not audited or adjusted."},{"code":"selection_not_adjusted","text":"Conditioning on successful completion can be anti-conservative when completion depends on assignment. Counting a failed attempt as no rejection preserves a single-attempt unconditional bound only when complete-data slot outcomes are defined for every assignment. No multiplicity adjustment across workloads, alternatives, sessions, or projects."},{"code":"no_semantic_equivalence_proof","text":"Output check: equal-within-pair. Matching captured bytes does not prove semantic equivalence. Descriptive mean(B)/mean(A) is an observed ratio, not a confidence interval, true-speedup estimate, regression gate, or equivalence finding."},{"code":"no_microbenchmark_accuracy_claim","text":"Elapsed timing includes launch, scheduling, exit-observation and concurrent capture effects. No sub-millisecond accuracy or cross-hardware reproducibility claim."}]}
